Category,Code,Name,Description
reject,1242,refuse to ease popular dissent,"reject requests, refuse, or decline to reduce or stop political protest activities, such as demonstrations and rallies."
reject,1243,refuse to release persons or property,"reject requests, refuse, or decline to release or return persons or property."
reject,1244,"refuse to ease economic sanctions, boycott, or embargo","reject requests, refuse, or decline to reduce or eliminate economic sanctions, boycotts, or embargoes."
reject,1245,refuse to allow international involvement (non-mediation),"reject requests, refuse or decline to allow access to international actors such as observers, humanitarian agencies, and peacekeeping forces."
reject,1246,refuse to de-escalate military engagement,"reject requests, refuse, or decline to stop fighting or take measures to ease military conflict or tension."
reject,125,"reject proposal to meet, discuss, negotiate","refuse to meet, discuss, or negotiate."
reject,126,reject mediation,refuse involvement of mediators or mediation initiatives.
reject,127,"reject plan, agreement to settle dispute","reject a proposal or request for a final, comprehensive settlement, peace proposal, or resolution."
reject,128,"defy norms, law","disobey, challenge, or resist laws or norms."
reject,129,veto,"refuse to assent or formally reject legislative proposal, recommendation, or resolution."
threaten,13,threaten,
threaten,130,"threaten, not specified in other sub-categories","all threats, coercive or forceful warnings with serious potential repercussions, not otherwise specified."
threaten,131,"threaten non-force, not specified in other sub-categories",all non-force threats not otherwise specified.
threaten,1311,threaten to reduce or stop aid,threaten to reduce or stop providing material aid.
threaten,1312,"threaten to boycott, embargo, or sanction","threaten to restrict normal economic interactions by imposing sanctions, boycotts, or embargoes."
threaten,1313,threaten to reduce or break relations,threaten to reduce or formally sever ties.
threaten,132,"threaten with administrative sanctions, not specified in other sub-categories",threaten to impose or expand non-force administrative restrictions and penalties not otherwise specified.
threaten,1321,threaten with restrictions on political freedoms,"threaten to impose or expand restrictions on fundamental freedoms, such as freedoms of speech, expression, and assembly."
threaten,1322,threaten to ban political parties or politicians,threaten to ban political activities of particular parties or individuals.
threaten,1323,threaten to impose curfew,threaten to enforce a deadline beyond which inhabitants of an area are not permitted to be on the streets or in public places.
threaten,1324,threaten to impose state of emergency or martial law,threaten with suspending certain given rights or the whole constitution by imposing state of emergency or military rule.
threaten,133,threaten political dissent,"threaten to mobilize or engage in actions of political dissent such as protest demonstrations, hunger strikes, strikes or boycotts, physical obstructions into buildings or areas, and riots."
threaten,134,threaten to halt negotiations,"threaten to break-up or withdraw from discussion, negotiation, or meeting."
threaten,135,threaten to halt mediation,threaten to stop mediation activities.
threaten,136,threaten to halt international involvement (non-mediation),"threaten to reduce or stop international intervention by expelling or withdrawing observers, humanitarian agencies, peacekeepers, etc."
threaten,137,threaten with repression,threaten dissidents with forcible subjugation.
threaten,138,"threaten with military force, not specified in other sub-categories",threaten to use force not otherwise specified.
threaten,1381,threaten blockade,threaten to prevent entry into and/or exit from a territory using military measures.
threaten,1382,threaten occupation,"threaten to occupy, seize control of the whole or part of a territory."
threaten,1383,threaten unconventional attack,"threaten to use unconventional violence, including terrorist activities."
threaten,1384,threaten conventional attack,"threaten to attack, use conventional weapons against a party."
threaten,1385,threaten unconventional mass violence,"threaten to use force potentially affecting large masses of people, including the use of weapons of mass destruction (nuclear or chemical-biologicalradiological attacks), mass expulsions or killings, as well as ethnic cleansing."
threaten,139,give ultimatum,"give a final warning, ultimate demand or order."
protest,14,protest,
protest,140,"engage in political dissent, not specified in other sub-categories.",all civilian demonstrations and other collective actions carried out as protests against the target actor not otherwise specified.
protest,141,"demonstrate or rally, not specified in other sub-categories","dissent collectively, publicly show negative feelings or opinions; rally, gather to protest a policy, action, or actor(s)."
protest,1411,demonstrate or rally for leadership change,"dissent collectively, gather, or rally demanding leadership change."
protest,1412,demonstrate or rally for policy change,"dissent collectively, gather, or rally demanding policy change."
protest,1413,demonstrate for rights,"dissent collectively, gather, or rally demanding political, social, economic, or other rights."
protest,1414,"demonstrate for change in institutions, regime","dissent collectively, gather, or rally demanding major institutional, constitutional, or regime change."
protest,142,"conduct hunger strike, not specified in other sub-categories","protest by refusing to eat until certain demands are met, not further specified."
protest,1421,conduct hunger strike for leadership change,refuse to eat until demands for leadership change are met.
protest,1422,conduct hunger strike for policy change,refuse to eat until demands for policy reform are met.
protest,1423,conduct hunger strike for rights,"refuse to eat until demands for political, social, economic, or other rights are met."
protest,1424,"conduct hunger strike for change in institutions, regime","refuse to eat until demands for major institutional, constitutional, or regime change."
protest,143,"conduct strike or boycott, not specified in other sub-categories","protest by refusing to work or cooperate until certain demands are met, not specified further."
protest,1431,conduct strike or boycott for leadership change,refuse to work or cooperate until demands for leadership change are met.
protest,1432,conduct strike or boycott for policy change,refuse to work or cooperate until demands for policy reform are met.
protest,1433,conduct strike or boycott for rights,"refuse to work or cooperate until demands for political, social, economic, or other rights are met."
protest,1434,"conduct strike or boycott for change in institutions, regime","refuse to work or cooperate until demands for major institutional, constitutional, or regime change."
protest,144,"obstruct passage, block, not specified in other sub-categories","protest by blocking entry and/or exit into building or area, not otherwise specified."
protest,1441,obstruct passage to demand leadership change,"obstruct passage, block entry/exit to demand leadership change."
protest,1442,obstruct passage to demand policy change,"obstruct passage, block entry/exit to demand policy reform."
protest,1443,obstruct passage to demand rights,"obstruct passage, block entry/exit to demand political, social, economic, or other rights."
protest,1444,"obstruct passage to demand change in institutions, regime","obstruct passage, block entry/exit to demand major institutional, constitutional, or regime change."
protest,145,"protest violently, riot, not specified in other sub-categories","protest forcefully, in a potentially destructive manner, not further specified."
protest,1451,engage in violent protest for leadership change,"protest forcefully, in a potentially destructive manner, to demand leadership change."
protest,1452,engage in violent protest to demand policy change,"protest forcefully, in a potentially destructive manner, to demand policy reform."
protest,1453,engage in violent protest to demand rights,"protest forcefully, in a potentially destructive manner, to demand political, social, economic, or other rights."
protest,1454,"engage in violent protest to demand change in institutions, regime","protest forcefully, in a potentially destructive manner, to demand major institutional, constitutional, or regime change."
exhibit military posture,15,exhibit military posture,
exhibit military posture,150,"exhibit military or police power, not specified in other sub-categories","all military or police moves that fall short of the actual use of force, not otherwise specified."
exhibit military posture,151,increase police alert status,need new description.
exhibit military posture,152,increase military alert status,heighten military readiness and caution; be prepared to use force.
exhibit military posture,153,mobilize or increase police power,increase the number of military personnel and/or weapons.
exhibit military posture,154,mobilize or increase armed forces,increase the number of military personnel and/or weapons.
exhibit military posture,155,mobilize or increase cyber-forces,increase the capacity to wage cyber-warfare.
reduce relations,16,reduce relations,
reduce relations,160,"reduce relations, not specified in other sub-categories","all reductions in normal, routine, or cooperative relations not otherwise specified."
reduce relations,161,reduce or break diplomatic relations,"curtail, decrease, break, or terminate diplomatic exchange."
reduce relations,162,"reduce or stop material aid, not specified in other sub-categories",reductions or terminations of aid not otherwise specified.
reduce relations,1621,reduce or stop economic assistance,decrease or terminate provision of economic aid.
reduce relations,1622,reduce or stop military assistance,decrease or terminate provision of military aid.
reduce relations,1623,reduce or stop humanitarian assistance,decrease or terminate provision of humanitarian aid.
reduce relations,163,"impose embargo, boycott, or sanctions",stop or restrict commercial or other material exchange as a form of protest or punishment.
reduce relations,164,halt negotiations,"terminate discussions, negotiations."
reduce relations,165,halt mediation,terminate mediation activities.
reduce relations,166,"expel or withdraw, not specified in other sub-categories",terminate the presence of groups or organizations not otherwise specified.
reduce relations,1661,expel or withdraw peacekeepers,terminate the deployment or presence of peacekeeping forces.
reduce relations,1662,"expel or withdraw inspectors, observers",terminate the presence of inspectors or other observers.
reduce relations,1663,expel or withdraw aid agencies,terminate the presence of aid agencies or other non-governmental organizations helping civilians.
coerce,17,coerce,
coerce,170,"coerce, not specified in other sub-categories","repression, violence against civilians, or their rights or properties not otherwise specified."
coerce,171,"seize or damage property, not specified in other sub-categories",use of force against property or violation of property rights not otherwise specified.
coerce,1711,confiscate property,"use force to take control of somebody else’s property, confiscate, expropriate."
coerce,1712,destroy property,"use force to destroy, demolish property."
coerce,172,"impose administrative sanctions, not specified in other sub-categories","formal decrees, laws, or policies aimed at curbing the rights of civilians not otherwise specified."
coerce,1721,impose restrictions on political freedoms,"violate or impose limitations on fundamental political rights such as freedoms of speech, expression, and assembly."
coerce,1722,ban political parties or politicians,prevent establishment or activities of political parties or politicians.
coerce,1723,impose curfew,set a deadline beyond which inhabitants of an area are not permitted to be on the streets or in public places.
coerce,1724,impose state of emergency or martial law,suspend normal constitutional rights and provisions by installing state of emergency or military rule.
coerce,173,"arrest, detain","legal or extrajudicial arrests, detentions, or imprisonments."
coerce,174,expel or deport individuals,"formal removal or expulsion of individuals from territories, typically following legal proceedings."
coerce,175,use repression,"actively repress collective actions of dissent by forcing subjugation through crowd control tactics, arrests, etc."
coerce,176,attack cybernetically,"illegal or unauthorized attack on computers, networks, or accounts."
assault,18,assault,
assault,180,"use unconventional violence, not specified in other sub-categories","use of unconventional forms of violence which do not require high levels of organization or conventional weaponry, not otherwise specified."
assault,181,"abduct, hijack, take hostage","kidnap, take hostage, hijack, or forcibly seize control of an aircraft, car, bus, ship, etc."
assault,182,"physically assault, not specified in other sub-categories","attack physical well-being of individuals without the use of weaponry, not otherwise specified."
assault,1821,sexually assault,"sexually abuse, assault sexual integrity of individuals."
assault,1822,torture,"torture, inflict extreme pain on individuals."
assault,1823,kill by physical assault,"kill individuals by physically assaulting them without the use of weaponry, through beating, torture, lynching, etc."
assault,183,"conduct suicide, car, or other non-military bombing, not specified",the use of explosive devices or improvised explosives outside of military engagements.
assault,1831,carry out suicide bombing,carry out bomb attack with the intention of causing own death as well as other casualties.
assault,1832,carry out vehicular bombing,blow up a car or other vehicle to cause damage to surroundings.
assault,1833,carry out roadside bombing,detonate explosives on the roadside to cause damage and casualties to passers-by.
assault,1834,carry out location bombing,the use of pre-placed explosive device(s) with the intent of causing casualties and or/structural damage.
assault,184,use as human shield,use civilians as buffer on the front lines or in other dangerous environments.
assault,185,attempt to assassinate,attempt but fail to kill politically significant and influential persons.
assault,186,assassinate,kill politically significant and influential persons.
fight,19,fight,
fight,190,"use conventional military force, not specified in other sub-categories",all uses of conventional force and acts of war typically by organized armed groups not otherwise specified.
fight,191,"impose blockade, restrict movement",prevent entry into and/or exit from a territory using armed forces.
fight,192,occupy territory,"occupy, seize control of a territory using armed forces."
fight,193,fight with small arms and light weapons,"attack using small arms and light weapons such as rifles, machine-guns, and mortar shells."
fight,194,fight with artillery and tanks,"attack using artillery, tanks, and rocket fire."
fight,195,"employ aerial weapons, not specified in other sub-categories","attack, bomb from air, not specified below."
fight,1951,employ precision-guided aerial munitions,the use of aerial weapons that utilize internal and/or remote sensing and guidance controls to strike specific targets.
fight,1952,employ remotely piloted aerial munitions,the use of remotely piloted or unmanned aerial platforms for the delivery or ordinance.
fight,196,violate ceasefire,reinitiate fighting in the midst of a formal or informal ceasefire or truce.
engage in unconventional mass violence,20,engage in unconventional mass violence,
engage in unconventional mass violence,200,"use massive unconventional force, not specified in other sub-categories","all uses of unconventional force that are meant to cause mass destruction, casualties, and suffering not otherwise specified."
engage in unconventional mass violence,201,engage in mass expulsion,force large groups of people or populations out of some territory.
engage in unconventional mass violence,202,engage in mass killings,"kill a substantial number of people, typically with the intention of ridding a territory of a particular group of people."
engage in unconventional mass violence,203,engage in ethnic cleansing,use mass expulsions and/or mass killings targeting a specific ethnic group.
engage in unconventional mass violence,204,"use weapons of mass destruction, not specified in other sub-categories",attack with unconventional weapons that are meant to cause massive destruction and casualties.
engage in unconventional mass violence,2041,"use chemical, biological, or radiological weapons","attack using chemical, biological, or radiological weapons."
engage in unconventional mass violence,2042,detonate nuclear weapons,attack using nuclear weapons.
